{
  "request_id": "fa3b351f-dce0-5669-800b-061b00c67321",
  "case_id": "aa4196f0-79d4-54cb-a84f-da34f8311531",
  "task_id": "bf554d10-0b59-5521-8b47-04648bc9fc57",
  "run_version": 1,
  "capability": "media.audio_fingerprint",
  "model_name": "synthetic_M33",
  "model_version": "0.1.0-fixture",
  "input_kind": "audio",
  "asset_ids": [
    "80e44889-31ab-5dd1-8721-e186ba9d9b02"
  ],
  "object_refs": [
    {
      "object_id": "53328619-19fc-5fd5-9b7a-ba5c1a27ae15",
      "version_id": "synthetic-v1",
      "sha256": "0000000000000000000000000000000000000000000000000000000000000000"
    }
  ],
  "source_segment_ids": [
    "ed0affce-a726-59fb-9dd4-74cbfb2d2e5e"
  ],
  "preprocessing_version": "synthetic-v1",
  "mapping_version": "synthetic-v1",
  "missing_modalities": [],
  "deadline_at": "2030-01-01T00:00:00Z",
  "authorization_version": "synthetic-v1"
}
